date,bloomberg_url,title,author,content,article_date
2023-01-06,https://www.bloomberg.co.jp/news/articles/2023-01-06/RO2TOYDWX2PT01,【米国市況】株は11月以来の大幅高、賃金の伸び鈍化－ドル132円付近,著者情報なし,"６日の米株式相場は反発。約１カ月ぶりの大幅高となった。12月の雇用統計で賃金の伸び減速が示されたことから、米金融当局がインフレ対応の強化を迫られることはないとの観測が広がった。
Ｓ＆Ｐ500種株価指数は昨年11月以来の大幅高となり、週間ベースでは1.5％上昇。ハイテク銘柄中心のナスダック100指数は同0.9％値上がり。両指数ともに週間で５週ぶりの上昇となった。
米雇用統計、12月は平均時給が鈍化－雇用22.3万人増、失業率低下 (2)
ＦＴＮファイナンシャルのチーフエコノミスト、クリス・ ロウ氏は「失業率が53年ぶり低水準となったことが真の問題で、米金融当局が労働市場のひっ迫解消に向けて2022年は全く進展しなかったことを示唆している」と指摘。「しかし、平均時給の伸びが11月分で下方修正された上、12月は予想を下回ったため、連邦公開市場委員会（ＦＯＭＣ）は時間稼ぎができる」と述べた。
ＦＢＢキャピタル・パートナーズの調査ディレクター、マイク・ベイリー氏は「これまでと違って、良いニュースは良いニュースのようだ。強い雇用の数字は時として悪いニュースとなるが、この日は楽観が広がっている。賃金の伸び鈍化はパウエル連邦準備制度理事会（ＦＲＢ）議長のさらなる引き締め計画に冷や水を浴びせている」と話した。
ＦＲＢ当局者、利上げ継続の必要性を相次ぎ強調－物価圧力緩和でも
米国債は上昇。特に短期債利回りが急低下し、金融政策に敏感な２年債利回りは一時21ベーシスポイント（ｂｐ、１ｂｐ＝0.01％）下げた。昨年12月の米ＩＳＭ非製造業総合景況指数が市場予想以上に低下し、縮小圏に陥ったことも材料になった。同年債利回りは週間では昨年11月以来の大幅な下げ。
米ＩＳＭ非製造業指数、予想外の縮小圏－20年４月以来の大幅低下 (2)
ＢＭＯキャピタル・マーケッツの米金利戦略責任者イアン・リンジェン氏は、次回会合での25ｂｐあるいは50ｂｐの利上げ幅を巡る議論は「来週の米消費者物価指数（ＣＰＩ）の数字次第になってくる」とリポートで分析した。
米債券市場の利上げ観測後退、２月は小幅な引き締めとの見方に傾斜
外国為替市場ではドル指数が低下し、３週間ぶりの大幅安となった。雇用統計で賃金の伸びが予想以上に鈍化し、ＩＳＭ非製造業指数も弱い内容となったことから、米利上げペースがさらに減速するとの見方が強まった。
ドルは対主要10通貨で全面安。対円では一時1.1％安の132円ちょうどを付けた。
ジェイ・ブライソン氏率いるウェルズ・ファーゴのエコノミストは「米経済成長は2022年10－12月（第４四半期）にしっかりとプラス圏を維持した。高インフレや金融引き締めの遅行効果が表れる中、当社では23年半ば以降に成長が緩やかに縮小するとの基本予測を維持している」と６日のリポートに記した。
キャピタル・エコノミクスの米国担当シニアエコノミスト、アンドルー・ハンター氏は「米雇用統計は米金融当局にとって強弱まちまちで、今後数会合は恐らく利上げを続けるだろう。しかし、労働市場状況の軟化は賃金の伸びを早期に一段と鈍化させると当社では引き続き見込んでいる。これは既に進行しているコアインフレの下降トレンドを後押しする見通しだ」と６日のリポートで分析した。
ニューヨーク原油相場は小幅に続伸した。一連の米経済指標の発表を受け、労働市場は底堅いが利上げペース減速の余地はあるとの見方が広がり、ドルが下落したことが背景。
オアンダのシニアマーケットアナリスト、エド・モヤ氏は「労働市場とサービス業に関する統計の発表後に原油相場は上昇した。これらの統計を受け、米金融当局は引き締めサイクル終了にかなり近づいているとの見方が強まったためだ」と指摘。「米国の過剰引き締めリスクが取り除かれれば、原油の需要見通しは改善し続けるはずだ」と述べた。
原油相場は週間ベースでは8.1％下落と、１カ月ぶりの大幅安。サウジアラビアがアジアと欧州向けの原油価格を引き下げ、短期的な需要見通しを懸念している様子が示唆された。中国が新型コロナウイルス感染拡大の抑制に手間取っていることも相場の重しとなった。
ニューヨーク商業取引所（ＮＹＭＥＸ）のウェスト・テキサス・インターミディエート（ＷＴＩ）先物２月限は、10セント（0.1％）高の１バレル＝73.77ドルで終了。ロンドンＩＣＥの北海ブレント３月限は12セント下げて、78.57ドルで終了した。
ニューヨーク金相場は反発。雇用統計で平均時給の伸びが市場予想を下回り、インフレ圧力が幾分和らいだことが示唆された。同統計発表後のドル安も金相場を支えた。
ＭＫＳパンプの金属戦略責任者、ニッキー・シールズ氏は「賃金の伸び鈍化は恐らく、インフレ重視の投資モデルを作動させるのに十分で、金相場は条件反射的に上昇した」と指摘。「雇用統計は昨年11月初旬以降の強気あるいは押し目買いトレンドを巻き戻すほど『悪く』はなかった」と述べた。
ニューヨーク商品取引所（ＣＯＭＥＸ）の金先物２月限は29.10ドル（1.6％）上昇し、１オンス＝1869.70ドルで終了した。
原題：Stocks Rise Most Since November; Treasuries Jump: Markets Wrap（抜粋）
Traders Slash Fed Bets After Data; Key Yield Inversion Deepens（抜粋）
Dollar Dips as Jobs Data Give Hope for Smaller Hike: Inside G-10（抜粋）
Oil Trims Weekly Loss as US Jobs Report Tames Dollar Strength（抜粋）
Oil Posts Largest Weekly Loss in a Month as Demand Fears Linger（抜粋）
Gold Climbs After US Jobs Data Comes in Near Expectations（抜粋）
— 取材協力 Peyton Forte, Isabelle Lee and Elena Popina",2023年1月7日 6:58 JST
2023-01-06,https://www.bloomberg.co.jp/news/articles/2023-01-06/RO3203T1UM0W01,米下院議長選、マッカーシー氏が過半数獲得に自信－休会後14回目投票,著者情報なし,"米共和党のマッカーシー下院院内総務は６日、「われわれは勝つ」と述べ、自身の下院議長就任に必要な票をさらに集めることに自信を示した。
下院は６日午後10時まで休会。午後に実施された12回目と13回目の投票では、十分な票を確保できなかったが、マッカーシー氏は反対していた同党議員21人のうち15人から賛成を取り付けた。14回目の投票で過半数を得るには、反対している残る６議員のうち少なくとも２人から支持を得る必要がある。
原題：McCarthy Sees Path to Victory in Hours as House Sets Late Vote（抜粋）",2023年1月7日 6:56 JST
2023-01-06,https://www.bloomberg.co.jp/news/articles/2023-01-06/RO2QHADWRGG001,ＥＣＢレーン氏、エネルギーコスト低下でもインフレ消えない,著者情報なし,"欧州中央銀行（ＥＣＢ）のチーフエコノミストを務めるレーン理事は、ユーロ圏のエネルギーコストは下がり始めているものの、インフレ圧力は高止まりするだろうと語った。
レーン氏は米ニューオーリンズで開かれたパネル討論に参加し、６日発表された昨年12月のユーロ圏インフレ率について「全体のインフレ動向にとって決定的なものではない」と指摘。ロシアのウクライナ侵攻が引き起こしたエネルギーショックや新型コロナウイルスのパンデミック（世界的大流行）からの経済再開が「向こう２年から３年にわたって」賃金に影響を及ぼすだろうと論じた。
12月のユーロ圏インフレ率は9.2％と、エコノミストが想定した以上に低下した。ただ、インフレ鈍化を主導したのはエネルギーで、エネルギーなどの変動の大きい項目を除いたコアインフレ率は過去最高の5.2％に達した。
ユーロ圏インフレ率、１桁台に低下－コアインフレは高水準続く (2)
賃金の上昇率は今のところ物価の伸びに追いついておらず、「今後数年のインフレを圧迫する」かい離が生じているとレーン氏は指摘した。
ＥＣＢは昨年に金利を合計で2.5ポイント引き上げ、今後も利上げを継続すると表明している。レーン氏はインフレ率を速やかに目標の２％に戻すには現水準の金利では十分ではなく、シミュレーションがそれを示していると説明した。
原題：ECB’s Lane Says Price Pressure Won’t Vanish If Energy Costs Ease（抜粋）",2023年1月7日 5:07 JST
2023-01-12,https://www.bloomberg.co.jp/news/articles/2023-01-12/ROE4DRT0G1KX01,グーグルとエヌビディアがアクティビジョン買収計画を懸念、ソニーに続く－関係者,著者情報なし,"米アルファベット傘下のグーグルとエヌビディアは、マイクロソフトによるアクティビジョン・ブリザード買収計画を巡り米連邦取引委員会（ＦＴＣ）に懸念を伝えた。事情に詳しい複数の関係者が明らかにしたもので、買収に反対するＦＴＣの論拠が強まった。
両社は690億ドル（現在のレートで約８兆9200億円）規模のアクティビジョン買収計画について、ソニーグループに続き問題を提起した。ＦＴＣは昨年12月、買収阻止を目指し審判手続き入りを決めた。ＦＴＣはビデオゲーム業界の競争を阻害すると主張し、８月に審判を予定している。いずれかの企業がこの審判の一部で証言を求められる可能性もある。
同関係者が手続きの部外秘を理由に匿名で語ったところによると、グーグルとエヌビディアは、マイクロソフトがクラウドやサブスクリプション（定額制）、モバイルゲームの市場で不公正な優位性を得る恐れがあるというＦＴＣの主張の要を支持する情報を提供した。エヌビディアはＦＴＣに対し、ゲームタイトルへのアクセスが公平かつオープンである必要性を強調したが、買収に直接反対しなかったと関係者１人が述べた。
ブルームバーグの報道を受け、12日のアクティビジョンの株価は取引時間中の安値に下げた。終値は76.90ドルで、１株当たり95ドルという買収条件を大きく下回り、買収手続き完了に苦戦するとの投資家の見方を示唆している。マイクロソフトは1.2％高の238.51ドル。
グーグルとエヌビディア、マイクロソフトの担当者はコメントを控えた。
原題：Google, Nvidia Express Concerns About Microsoft-Activision Deal (1)（抜粋）",2023年1月13日 8:25 JST
2023-01-12,https://www.bloomberg.co.jp/news/articles/2023-01-12/ROE4R2T1UM0W01,日米首脳会談、先端半導体技術の対中輸出規制が議題に－関係者,著者情報なし,"バイデン米大統領は数日中にワシントンを相次いで訪問する岸田文雄首相とオランダのルッテ首相との会談で、半導体技術への中国のアクセス制限を巡る協力について話し合う見通しだ。
このテーマは13日の日米首脳会談と17日の米蘭首脳会議で議題となる安全保障問題の一つになる。事情に詳しい関係者が匿名を条件に語った。
日本とオランダはバイデン政権が打ち出した厳格な輸出規制への一部参加に基本合意していると、ブルームバーグ・ニュースが先月報じた。だが同関係者によると、今回の首脳訪米中は技術に関する合意の発表はない見通し。
高性能半導体の製造に必要な装置の主要メーカー５社のうち、アプライド・マテリアルズとＫＬＡ、ラムリサーチの３社は米国企業であるため対中輸出規制の直接の対象となっている。他２社はオランダのＡＳＭＬホールディングと東京エレクトロン。
日本、半導体製造装置の対中輸出規制で米国と協調へ－関係者 (4)
バイデン米政権、半導体技術の対中輸出で新たな制限発表
原題：Biden to Talk China Tech With Japan, Dutch Leaders in Washington（抜粋）
— 取材協力 Peter Elstrom",2023年1月13日 7:32 JST
2023-01-12,https://www.bloomberg.co.jp/news/articles/2023-01-12/ROE5OXT0AFB401,日加首脳､ＬＮＧ･重要鉱物で協力強化へ－産業ミッション相互訪問発表,著者情報なし,"岸田文雄首相は12日午前（日本時間13日未明）、訪問先のカナダの首都オタワでトルドー首相と会談した。岸田首相は日本企業も参画し、カナダ太平洋岸からアジア市場に向けに液化天然ガス（ＬＮＧ）を輸出する「ＬＮＧカナダプロジェクト」に言及し、エネルギー分野での両国の協力強化に意欲を示した。
トルドー首相は日本の新たな国家安全保障戦略を歓迎する一方、エネルギーと食料、成長産業を支えるクリティカルミネラル（重要鉱物）、先端技術分野に重点を置く貿易ミッションを10月に日本に派遣すると表明した。日本の電池製造業界を代表する最高経営責任者（ＣＥＯ）のグループが数カ月中にカナダを訪問する予定も明らかにした。
主要７カ国（Ｇ７）の５カ国を歴訪中の岸田首相は、最後の訪問地である米国の首都ワシントンで、現地時間13日（同14日）にバイデン大統領と首脳会談に臨む。
原題：Trudeau Says Canada Will Send Trade Mission to Japan in October（抜粋）",2023年1月13日 7:26 JST
2023-01-13,https://www.bloomberg.co.jp/news/articles/2023-01-13/ROFEAIT0AFBU01,米ブラックロック、長期投資ファンドへの顧客資金流入続く,著者情報なし,"世界最大の資産運用会社、米ブラックロックの長期投資ファンドへの顧客資金流入が昨年10－12月（第４四半期）も続いた。
同社が13日発表した資料によれば、こうした商品への10－12月の純流入は1460億ドル（約18兆6700億円）。ブルームバーグがまとめたアナリストの予想平均（1240億ドル）を上回った。
ブラックロックの運用資産は８兆5900億ドルと、９月末時点の７兆9600億ドルから増加。顧客資金の流入と10－12月の株式・債券市場回復が寄与した。
原題：BlackRock Gets $146 Billion of Fresh Cash After Market Rout (2)（抜粋）",2023年1月14日 8:47 JST
2023-01-13,https://www.bloomberg.co.jp/news/articles/2023-01-13/ROFCQDT0G1KZ01,中国国有の東方航空と南方航空、ニューヨーク証取の上場廃止へ,著者情報なし,"中国東方航空と中国南方航空は13日、ニューヨーク証券取引所の上場廃止を申請した。中国政府系の企業は昨年、米国の株式市場から相次ぎ撤退しており、国有航空の２社もこれに追随する。
東方航空と南方航空はニューヨーク証取に上場している米国預託株式（ＡＤＳ）を自主的に廃止するとそれぞれ届け出た。両社は香港に比べて取引高などが少ないにもかかわらず、米上場を維持するためのコストがかさんでいることなど商業的観点からの決定だと説明している。
原題：China State-Owned Airlines to Delist in New York, Joining Exodus（抜粋）
— 取材協力 John Liu and April Ma",2023年1月14日 8:42 JST
2023-01-13,https://www.bloomberg.co.jp/news/articles/2023-01-13/ROFU5ST0G1KW01,バイデン米大統領、２月７日に一般教書演説－連邦議会で,著者情報なし,"バイデン米大統領（民主党）の一般教書演説が２月７日に連邦議会の上下両院合同会議で行われる。ホワイトハウスが13日発表した。大統領がマッカーシー下院議長の招待を受け入れたとジャンピエール大統領報道官が記者会見で述べた。
野党共和党による下院多数派奪還後、バイデン大統領が議会で演説するのは初めてで、ウクライナでの戦争や米連邦債務上限引き上げなど広範な問題が取り上げられるとみられる。
原題：Biden to Give State of the Union Feb. 7 as Debt Fight Looms（抜粋）",2023年1月14日 7:22 JST
2023-01-18,https://www.bloomberg.co.jp/news/articles/2023-01-18/ROPAZIT0G1KW01,アルコア株が下落、今年のアルミ出荷見通しが市場予想下回る,著者情報なし,"米アルミニウム生産最大手アルコアの今年のアルミ出荷は市場予想を下回る見通しだ。世界的なインフレや欧州の需要低迷、世界最大のアルミ消費国である中国の軟調な経済見通しに伴い不透明感が漂っている。
18日発表した昨年10－12月（第４四半期）決算資料によると、アルコアは今年のアルミ出荷を250万－260万トンと見込む。これは昨年のガイダンスと同水準だが、ブルームバーグ集計のアナリスト予想平均（265万トン）を下回る。
同社の株価は通常取引終了後の時間外取引で一時4.4％下げた。
アルミ価格は昨年15％余り下落した。世界的なインフレ高進や個人消費減速で自動車や電化製品、窓枠向けの需要が落ち込んだ。
ロイ・ハービー最高経営責任者（ＣＥＯ）は発表資料で「昨年、世界的な混乱がエネルギーや原材料コストにマイナスに働いた。製品価格設定は2022年の上期と下期の間に大きな変化が見られた」とした上で、「さらなる改善に向け行動を取っている」と説明した。
アルコアによると、10－12月期の一部項目を除いた調整後利益は2900万ドル（約37億円）で、ブルームバーグ集計のアナリスト９人の予想平均１億690万ドルに届かなかった。
欧州の大幅な供給削減や世界２位の生産国であるロシアからの購入に消極的な動きが見られることを背景にアルミが世界的に不足しているものの、アルコアは今回の出荷見通しを示した。同社は昨年とほぼ横ばいのアルミ出荷を見込んでいる理由の一つに、予想より低調な取引高を挙げた。
原題：Alcoa Drops as Shipments Seen Stagnating Amid Shaky Demand (1)（抜粋）",2023年1月19日 7:03 JST
2023-01-18,https://www.bloomberg.co.jp/news/articles/2023-01-18/ROO0CAT0G1KW01,19日の日本市場、揺り戻し相場か－長期金利0.4％台、円買い、株反落,著者情報なし,"19日の日本市場は前日の反動が出そうだ。日本銀行が18日に金融緩和策の現状維持を発表した後に進んだ金利低下と円安、株高の動きを調整しそうだ。
アシンメトリック・アドバイザーズのシニアストラテジスト、アミール・アンバーザデ氏は「日銀は国債を買い増すことでイールドカーブコントロール（ＹＣＣ）を守り続けることを余儀なくされ、これで何かが変わるとは思えない」とし、「遅かれ早かれ、黒田総裁体制にしろ次期総裁体制にしろ日銀はＹＣＣを修正する必要がある」との見解を示した。
新発10年国債利回りは0.4％台を保ちそうだ。18日の新発10年国債利回りは一時0.36％と日銀の許容上限0.5％を大幅に下回った後、0.41％台に戻して取引終了。日銀の介入がない翌日物金利スワップ（ＯＩＳ）市場でも円建て10年物が0.74％に低下する場面があった。
ＳＭＢＣ日興証券の丸山義正チーフマーケットエコノミストはリポートで、「12月の驚天動地の政策決定により日銀自身がパンドラの箱を開け金融市場の信頼を失った」とした上で、１月会合の現状維持にもかかわらず、債券市場などでさらなる政策修正を催促する相場が継続する可能性は相当に高いとみている。
東海東京証券の佐野一彦チーフ債券ストラテジストは、「総裁交代は政策修正のタイミングになると考える関係者は少なくなく、ＹＣＣアタック（政策修正を見込んだ売り）は再び活発になるだろう」と記した。
外国為替市場の円相場は128円台後半で強含み。18日は日銀会合の結果発表を受けて、円は対ドルで２％超下落し、一時１ドル＝131円台半ばまで値を切り下げていた。
野村証券の後藤祐二朗チーフ為替ストラテジストは、共通担保資金供給オペ拡充に反応して国債利回りが大幅低下していることの影響も加味すると、この程度の円安は想定内だと指摘。総裁交代のタイミングで日銀がＹＣＣ撤廃を判断する可能性は残るので、「ゲームチェンジャーという形でドル・円がどんどん円安方向に動く可能性は低い」と述べた。
株式相場は円高や米小売売上高の大幅減を背景に反落する見込み。18日の株式市場では、日銀の発表を受けて国内金利上昇に伴う外国為替の円高や景気圧迫リスクが後退したとみた投資家の買いが優勢になった。一方で金利先高観が後退し、銀行株は値を下げた。
証券ジャパン調査情報部の野坂晃一次長は銀行株について「今後どこまで株価が戻るかは未知数だが、18日の下げは利益確定売りを出した後に押し目を待っていた向きには絶好の買い場になった」と指摘する。
— 取材協力 Masahiro Hidaka, Saburo Funabiki, Emi Nobuhiro, Daisuke Sakai, Hiroko Komiya, Toshiro Hasegawa, Ruth Carson and Matthew Burgess",2023年1月19日 8:16 JST
2023-01-18,https://www.bloomberg.co.jp/news/articles/2023-01-18/ROPDV1DWLU6A01,岸田首相が子育て支援「最重要政策」に、施政方針原案が判明－報道,著者情報なし,岸田文雄首相が23日召集の通常国会で行う施政方針演説の原案が判明したと時事通信が19日報じた。首相は、こども・子育て支援政策を「経済社会の持続性と包摂性を考える上で最重要政策」と表明するという。,2023年1月19日 8:00 JST
2023-01-20,https://www.bloomberg.co.jp/news/articles/2023-01-20/ROSXP2DWX2PS01,ＮＺ次期首相、ヒプキンス教育相が就任へ－アーダン氏の後任,著者情報なし,"ニュージーランドの次期首相にヒプキンス教育相（44）が就任する見通しとなった。与党・労働党は21日、辞意を表明したアーダン首相の後任となる次期党首はヒプキンス氏が唯一の候補だと明らかにした。
労働党は声明で、ヒプキンス氏の党首就任は翌日の党員集会で承認される必要があるとしている。首相府によると、同氏は現地時間21日午後１時（日本時間午前９時）にメディアに対して発言する予定。
アーダンＮＺ首相、辞意を突如表明－総選挙は10月14日実施
原題：Hipkins Set to Succeed Ardern as New Zealand Prime Minister (3)（抜粋）",2023年1月21日 6:14 JST
