date,bloomberg_url,title,author,content,article_date
2024-10-04,https://www.bloomberg.co.jp/news/articles/2024-10-04/SKUPU1T0AFB400,「本塁打」級の米雇用統計、ＦＲＢの肩の荷軽減－労働市場の懸念後退,著者情報なし,"９月の米雇用統計が予想を上回る強い内容となったことで、労働市場を巡る懸念が後退し、金融当局には今後数カ月に一段と漸進的なペースで利下げを続ける余地が生じた。当局へのプレッシャーは軽減された形だ。
ＪＰモルガン・チェースの米国担当チーフエコノミスト、マイケル・フェローリ氏が「本塁打」と呼んだ統計発表を受け、金融当局が９月の0.5ポイント利下げに続き、11月６、７両日の連邦公開市場委員会（ＦＯＭＣ）会合でも大幅利下げを検討するとのエコノミストや投資家の観測はほぼ直ちに減退した。
米雇用者数の伸び、９月は全予想上回る－失業率は4.1％に低下
以前は大幅な追加利下げを予想していたフェローリ氏だが、４日の顧客向けリポートでは、「今日の発表で米金融当局の仕事も比較的容易になるだろう。われわれは現時点で0.25ポイントの利下げ路線を予想している」とコメントした。
このほかにも、バンク・オブ・アメリカ（ＢｏｆＡ）の米国担当シニアエコノミスト、アディトヤ・バビ氏は11月の利下げ幅見通しを0.25ポイントに切り替え、ＢＮＰパリバの米国担当シニアエコノミスト、エレーナ・シュルヤティエバ氏も「落ち着いたペース」での利下げを見込むとしている。
シュルヤティエバ氏は顧客向けリポートで、「９月の雇用者数の大幅な伸び加速や失業率の低下は、過去数週間の米経済指標で示された広範な力強さと相まって、底堅さを新たに裏付けるサインとなり、ソフトランディング（軟着陸）の根拠を強める」との見方を示した。
雇用統計の発表に先立つ３日、米港湾労働者の労働組合は同国東海岸とメキシコ湾岸で行っていた大規模なストライキを中断することに同意し、ストは３日間で終了した。
こうした一連のニュースを背景に、米金融当局の次の動きに関する議論は当面、リセットされた。フェデラルファンド（ＦＦ）金利先物市場で投資家が織り込む11月の利下げ幅は0.25ポイントと、雇用統計発表前に比べ約10ベーシスポイント（ｂｐ、１ｂｐ＝0.01％）圧縮されている。
パウエル連邦準備制度理事会（ＦＲＢ）議長は９月30日、同月のＦＯＭＣ会合後に公表された最新の金利予測分布図（ドット・プロット）で、11月と12月の会合について当局者がそれぞれ0.25ポイントずつの利下げ見通しを示唆したことに言及していた。
サマーズ元米財務長官、９月の50ｂｐ利下げは「間違いだった」
エラリアン氏が警告、「インフレは死んでいない」－米雇用統計好調で
シカゴ連銀総裁、雇用統計「素晴らしい内容」－過度な反応には警鐘
ドラッケンミラー氏、ＦＲＢが「ガイダンスに縛られないこと望む」
原題：Jobs Report ‘Dinger’ Takes Pressure Off Fed for Next Meeting（抜粋）
— 取材協力 Craig Torres, Augusta Saraiva, Michael McKee and Susanne Barton",2024年10月5日 8:56 JST
2024-10-04,https://www.bloomberg.co.jp/news/articles/2024-10-04/SKUFK1DWX2PS00,【米国市況】株と利回り上昇、市場は利下げ予想を修正－148円台後半,著者情報なし,"４日の米金融市場では国債が急落。米雇用統計が市場予想を上回ったことを受け、トレーダーらは米連邦公開市場委員会（ＦＯＭＣ）による次の利下げ幅に関して再考を迫られた。株は上昇し、Ｓ＆Ｐ500種株価指数はこの日の高値付近で引けた。雇用統計で米経済の底堅さが浮き彫りとなり、ソフトランディング期待が強まった。
金融政策に敏感な米２年債利回りは一時3.93％を付けた。９月の米雇用統計では、非農業部門雇用者数が前月比25万4000人増と、６カ月で最大の伸び。失業率は4.1％に低下した。11月の米利下げ幅に関するトレーダーの織り込みは現在、0.25ポイント未満となっている。
Ｓ＆Ｐ500種指数とナスダック100指数は９月19日以来の大幅高。共に、週間ベースでも小幅に値上がりした。
今週は民間セクターの雇用者数や非製造業の景況指数といった雇用統計以外のデータも、米経済が力強い状態にあることを示した。
プラント・モラン・ファイナンシャル・アドバイザーズのジム・ベアード最高投資責任者（ＣＩＯ）は「雇用のデータは夏の間は相対的に弱さが続いたが、９月に関してはまさに医者（つまりこの場合ＦＯＭＣ）が指示した通りの内容となった」と指摘。９月の雇用統計は「最近の傾向を断ち切り、労働経済の基調的な底堅さを楽観する上での根拠を示した」と述べた。
また同氏は、今回の雇用統計で経済見通しが変わるわけではないものの、投資家やＦＯＭＣが労働市場について抱いていた懸念を和らげるはずだと付け加えた。
ただ、全ての投資家が雇用統計をポジティブに見ているわけではない。英ケンブリッジ大学クイーンズカレッジ学長のモハメド・エラリアン氏は、雇用統計はＦＯＭＣのインフレとの闘いが終わっていないことを意味するとして警告を発した。
ブルームバーグテレビジョンのインタビューでエラリアン氏は、「これは単に堅調な労働市場ということではなく、これらの数字を額面通りに受け取れば、サイクル後期における強い労働市場だといえる」と発言した。
また248ベンチャーズのチーフ投資ストラテジスト、リンジー・ベル氏は、雇用統計における賃金の上昇は、インフレが根強くとどまることをＦＯＭＣに再認識させそうだと指摘した。
ただそれでも、雇用統計を全体として見れば、ＦＯＭＣがソフトランディングを達成し、株価が確実にプラス圏を維持するという期待を強める内容となった。
シチズンズのマネジングディレクター、エリック・メルリス氏は「雇用統計を受けて、ＦＯＭＣが利下げを継続するに当たっての柔軟性が高まることになり、当局の対応が遅すぎたという声を打ち消すのにも役立つはずだ」と述べた。
外国為替市場ではドル指数が上昇。週ベースでは2022年９月以来の大幅高となった。９月の米雇用者数の伸びが全ての市場予想を上回り、大幅利下げに対する市場の期待が後退した。円は対ドルで１％余り下落。週間では09年12月以来の大幅安となった。
円は対ドルで１ドル＝148円台後半。雇用統計の発表前は146円台半ばで推移していたが、統計に反応して下げに転じ、一時1.4％安の149円を付けた。
市場の注目は次の重要データであるインフレ指標に移っている。
ＵＢＳグローバル・ウェルス・マネジメントのブライアン・ローズ氏は「予想より強かった雇用データに加え、物価の上昇ペースも予想を上回れば、ＦＯＭＣが11月会合で利下げを見送る可能性は高まる」と述べた。
ＣＩＢＣキャピタル・マーケッツの為替戦略責任者、サラ・イン氏は「われわれは、けさの好調な非農業部門雇用者数のデータから一歩引いて、ドルをより大きな視点で捉えている」と説明。「ＦＯＭＣが正常化を続ける中、ドルの長期的なトレンドは下落方向だと、われわれはなお考えている」と述べた。
その上で、「非農業部門雇用者数の今後の道筋が、最終的に向こう数四半期におけるドルの下落ペースを左右することになるだろう」と分析した。
ニューヨーク原油先物相場は４日続伸。ただ、日中高値の水準からは上げを縮小した。イラン石油施設への攻撃を思いとどまるようバイデン米大統領がイスラエルに促したとの報道が材料となった。
バイデン氏、イスラエルに自重を促す－イラン石油施設への攻撃巡り
ウェスト・テキサス・インターミディエート（ＷＴＩ）は一時、前日比2.5％上昇した。
バイデン大統領は「もし私が彼らの立場だったら、油田を攻撃する以外の選択肢を考えていると思う」と記者団に語った。
中東情勢への懸念を背景に、ＷＴＩは今週９％ほど上昇した。イスラエルとイラン、その代理勢力による戦闘が他国を巻き込む全面戦争につながるとの懸念が強まっている。
ＳＥＢのチーフ商品アナリスト、ビャルネ・シールドロップ氏は「最悪シナリオが現実のものとなる可能性は非常に低いが、イスラエルがイランに報復攻撃を行うとみられる中、向こう数日の動向が引き続き懸念されている」と述べた。
ニューヨーク商業取引所（ＮＹＭＥＸ）のＷＴＩ先物11月限は67セント（0.9％）高の１バレル＝74.38ドルで終了。ロンドンＩＣＥの北海ブレント12月限は43セント（0.6％）高の78.05ドルで引けた。
金スポット相場は上下に大きく振れた後、軟調に推移した。中東情勢の緊迫化と、予想を上回った米雇用統計という２つの材料を見極めようというムードだった。
雇用統計が力強い内容となり、市場で大幅利下げ観測が後退したことを受け、金は一時、前日比0.9％下げた。利子の付かない金は金利が低下すると買われる傾向にある。
一方で金は通常、地政学的・経済的な不確実性が強まった際に選好される。逃避先資産としてのこうした需要を背景に、金スポット相場は一時プラス圏に浮上した。
スポット価格はニューヨーク時間午後２時55分現在、0.4％安の１オンス＝2646.31ドル。ニューヨーク商品取引所の金先物12月限は11.40ドル（0.4％）安の2667.80ドルで引けた。
原題：Stocks Close Near Session Highs; Yields Climb: Markets Wrap（抜粋）
Dollar Eyes Best Week in Two Years; Yen Falls Most: Inside G-10
Oil Pares Gain as Biden Discourages Attack on Iran’s Oil Fields
Gold Swings as Traders Assess US Jobs Data, Middle East Tensions
— 取材協力 Emily Graffeo, Sid Verma and Sydney Maki",2024年10月5日 5:58 JST
2024-10-04,https://www.bloomberg.co.jp/news/articles/2024-10-04/SKUH6RT0AFB400,ＪＰモルガン、ダイモンＣＥＯはトランプ氏への支持を表明していない,著者情報なし,"米銀ＪＰモルガン・チェースのジェイミー・ダイモン最高経営責任者（ＣＥＯ）は、今年の米大統領選でトランプ前大統領への支持を表明していないと、同行の広報担当者が明らかにした。これより先、トランプ氏はダイモン氏が自分を支持したと自身のソーシャルメディアに投稿していた。
ＪＰモルガン広報担当のジョー・エバンジェリスティ氏は「ジェイミーは候補者への支持をこれまでのところ表明していない」と電子メールで述べた。
トランプ陣営にこの日のソーシャルメディア投稿についてコメントを求めたが、返答はまだ得られていない。
ダイモン氏はいずれの候補者もまだ支持していないが、選挙戦では積極的な発言を行っている。約２カ月前には米紙ワシントン・ポストへの寄稿で、国内問題および地政学問題が山積する中、次期米大統領は「深く分断した」国家を結束させることに注力しなければならないと論じた。３月には、ハリス副大統領がバイデン大統領に代わって民主党候補になる前に、ハリス氏と昼食を共にしている。
ダイモン氏が次期米大統領に提言、経済界から閣僚起用を－米紙に寄稿
「ダイモン財務長官」発言を否定－考えたことないとトランプ氏が投稿
トランプ氏、ＦＲＢ議長の任期満了前の解任は目指さず－円安にも言及
原題：JPMorgan Says Dimon Hasn’t Endorsed Trump for President (1)（抜粋）",2024年10月5日 4:50 JST
2024-10-21,https://www.bloomberg.co.jp/news/articles/2024-10-21/SLPGHST0AFB400,米選挙は債券利回りに大きなリスク、インフレ再加速も－マーフィー氏,著者情報なし,"米選挙で共和党圧勝、あるいは民主党が圧勝した場合でも、さらなる財政刺激策が講じられる可能性があり、その結果インフレが再び加速し、米利下げペースが鈍化する公算が大きいと、インサイト・インベストメントの北米債券責任者ブレンダン・マーフィー氏はみている。
同社は現時点で社債をオーバーウエートにしている。この資産クラスへの資金流入が「膨大」であるほか、米金融当局の緩和政策が追い風となっており、企業は債務のタームアウト（長期化）をうまく進めているとマーフィー氏は指摘した。
だが11月の米大統領選が近づくにつれ、社債のリスクが高まっている。
17日のインタビューで「これは債券利回り全般にとって大きなリスクだが、リスク資産や信用スプレッドにとってもリスクだろう。正常化への回帰を市場がほぼ完全に織り込んでいるためだ」と語った。
原題：US Election Is ‘Big Risk’ to Bond Yields, Says Insight’s Murphy（抜粋）",2024年10月22日 8:53 JST
2024-10-21,https://www.bloomberg.co.jp/news/articles/2024-10-21/SL19EFT1UM0W00,【丸の内Insight】三菱ＵＦＪ次期トップ選び本格化､来春に新体制,著者情報なし,"皆さん、こんにちは。布施太郎です。今月のニュースレターをお届けします。
経済記者にとって取材対象企業のトップ人事は重要なテーマです。企業は人で成り立っているということを考えれば、かじ取りを誰が担うかによって進路が大きく変わるのは自明です。その企業が抱える課題は何なのか。課題解決にはどのような知見や能力が必要なのか。もちろん時代や環境によって求められるリーダー像も異なります。そうしたことを取材先と議論しながら考えます。
一方で、人の集合体である企業は、それぞれ固有の権力構造を抱えています。派閥であったり、合併企業であれば旧社のグループであったりします。その権力構造に分け入り、どこまで取材を深めることができるのか。記者の力量が問われる局面でもあります。
自分自身がこれまで深く取材できたという自負も成果もありません。ただ、かつてある大手銀行のトップに後任の要件を尋ねた際、最初に挙がったのは、「トップの権力を自分のために行使しない人」でした。その発言で候補の１人と考えられていた人物がすでにリストから外れていることを知り、驚いた記憶があります。
今回は、三菱ＵＦＪフィナンシャル・グループ（ＭＵＦＧ）のトップ人事の行方に焦点を当てました。国内最大の金融グループはどのような人物に未来を託すのでしょうか。
ＭＵＦＧが次期トップ選定のプロセスを本格化させる。亀澤宏規社長は来春で就任から５年となるが、このタイミングでＭＵＦＧとグループ中核の三菱ＵＦＪ銀行は新トップの下での体制に移行する見通しだ。金利のある世界の到来や急速に進むデジタル化で経営環境が大きく変わる中、国内最大の金融グループのかじ取りを誰が担うのか。トップレースは最終局面に入る。
指名委員会等設置会社となっているＭＵＦＧは、社外取締役を中心に構成する「指名・ガバナンス委員会」が取締役の選解任を決める。５人の委員のうち、亀澤社長以外の４人が社外取で、委員長は筆頭独立社外取締役の野本弘文氏（東急代表取締役会長）が務める。
複数の関係者によると、同委員会は年に４回程度のペースで開かれ、常にサクセッションプラン（後継者計画）を検討しているが、11月から亀澤社長の後任人事と三菱ＵＦＪ銀行を中心としたグループ各社の首脳人事に向けた大詰めの議論に入る。執行サイドが提出した候補者リストを基に指名・ガバナンス委が対象者のインタビューを行い、絞り込むという。
二代前の平野信行社長が社長退任後に持ち株会社会長に就いて以降その流れは続き、現在の三毛兼承会長も社長から会長に就任。同関係者らは亀澤社長も三毛会長の後任に就く可能性が高いとしている。亀澤社長の後任には三菱ＵＦＪ銀の半沢淳一頭取（1988年旧三菱銀行入行、東京大学経済学部）が有力視されている。
2021年に三毛氏の後を継いで頭取に就任した半沢氏は、この３年半で三菱ＵＦＪ銀行の収益力回復に尽力した。就任直前の21年３月期の銀行単体当期純利益は３メガバンク中３位の1445億円と、みずほ銀行の2674億円、三井住友銀行の3380億円に大きく劣後。しかし、24年３月期には8043億円にまで引き上げ、ライバル２行を凌駕（りょうが）する水準にまで立て直した。
ＭＵＦＧは24年３月期のグループ連結当期純利益で過去最高となる１兆4908億円をたたき出し、収益面での半沢頭取の貢献は大きい。ある役員は半沢氏について、トップになる帝王学を身に付けているとし、本命視する声が多い。
一方で、20年に副社長から社長に昇格した亀澤氏は、同社で初めて銀行頭取を経ずにトップになった。経営のバトンを渡した当時の三毛社長は記者会見で「銀行頭取の経験がＭＵＦＧという総合金融グループをけん引していく上で必ずしも必要だとは考えていない」と述べており、半沢氏以外のトップ起用の可能性も残されている。
半沢氏が社長に就いた場合、焦点となるのは三菱ＵＦＪ銀頭取の後任人事だ。複数の関係者によると、４人が候補に挙がっている。（五十音順）
常務執行役員でグローバルコマーシャルバンキング事業本部副本部長を務める大澤正和氏（1991年旧三菱銀行入行、東京大学法学部卒）は、デジタル部門と海外部門での経験が強みだ。シンガポールの配車大手グラブへの出資では当時の亀澤副社長の下で出資をまとめるなど、グループのデジタル戦略を引っ張ってきた。
現在は、グループが成長領域として位置付けるアジア地域の責任者を務める。自らの部門に縛られない全社的な目線でものを考えるとの評がある。
代表執行役常務でグループＣＳＯ（最高戦略責任者）の髙瀬英明氏（91年旧三菱銀行入行、一橋大学経済学部卒）は、2024年３月期から始まった中期経営計画の取りまとめを担当した。前中計の増加幅3600億円を大きく上回る5000億円以上の営業純益の上積みを図る野心的な計画を練り上げた。
21年に欧州担当になった際には、英国の欧州連合（ＥＵ）離脱（ブレグジット）後に混乱した欧州事業の再編やリストラ、欧州当局との折衝に力を注いだ。部下の話を丁寧に聞くとの評がある。
代表執行役専務で法人・ウェルスマネジメント事業本部長の宮下裕氏（1990年旧三和銀行入行、京都大学法学部卒）は、海外から法人やリテール業務まで幅広い業務を担ってきた。現在は、従来型の資産運用だけでなく、オーナー企業の事業承継などから派生する業務も富裕層ビジネスとして位置付け、拡大させている。
自ら掲げた目標に対するコミットメントが強いとされ、旧三和銀行出身のエースとしても期待されている。
執行役常務でリテール・デジタル事業本部長兼グループＣＤＴＯ（最高デジタル・トランスフォーメーション責任者）の山本忠司氏（92年旧東京銀行入行、東京大学経済学部卒）は、グループ横断のデジタル戦略を担う。銀行やカード、証券、消費者金融などグループの各業態を束ねたマスリテール向けのプラットフォーム戦略の巻き返しを図っている。
常に物腰が柔らかく、決して部下を責めることをしない姿勢は、グループ内での信頼感の醸成に一役買っており、グループ各社の一体感が高まっているという。
ＭＵＦＧは2024年３月期に続き25年３月期も最高益を更新する見通しだ。マイナス金利政策解除による追い風もあるが、海外を中心とした出資戦略が着実に成果に結び付いている。
その一方で、国内のリテール戦略ではライバル行と比べて出遅れも目立つ。金利のある世界の到来で、粘着性の高い預金の調達基盤となるリテール戦略の重要性は増している。グローバル競争で勝ち抜くためには、マザーマーケットである日本で盤石な体制をつくれるかどうかも課題となる。メガバンクの中で最もグローバル化が進んでいるが、世界の不確実性が高まる中、慎重かつ大胆な判断も求められる。
金融セクターで圧倒的な地位を占めるＭＵＦＧは、国内全業種の中でも時価総額でトヨタ自動車の約40兆円に次ぐ約20兆円を誇る。しかし、世界の金融界では13位にとどまっている。さらなる成長を目指してＭＵＦＧがどのような新トップにグループのかじ取りを任せるのか。今回の人事が中長期のＭＵＦＧの帰趨（きすう）を決めることになる。
ＭＵＦＧの広報担当者は、トップの選任についてコメントを差し控えると回答した。また、半沢頭取らに広報担当者を通じてコメントを求めたが、差し控えるとした。",2024年10月22日 5:30 JST
