date,bloomberg_url,title,author,content,article_date
2024-01-09,https://www.bloomberg.co.jp/news/articles/2024-01-09/S70E7DDWX2PS00,米国防長官は前立腺がん手術後の合併症で入院－医師団公表,著者情報なし,"オースティン米国防長官が今月１日に入院したのは前立腺がんの手術を受けた後の合併症によるものだったと、ウォルター・リード米軍医療センターの医師団が９日公表した。
医師団の声明によると、オースティン長官（70）は昨年12月上旬に受けた定期検診で前立腺がんが見つかり、同月下旬に全身麻酔で切除手術を受けた。その後退院したが、感染症にかかり腹水がたまって腸閉塞を起こしたという。
複数の議員はオースティン長官がホワイトハウスや議会に入院を数日間報告せず、米軍の指揮体制が機能不全となるリスクが露呈したことを問題視し、国防総省により詳細な説明を求めていた。
医師団は声明で、オースティン長官は「入院中、着実に回復している」とした上で、「感染症は治まった。経過は順調で、時間はかかるかもしれないが完治するとみている」と説明した。
一部共和党議員はオースティン長官の辞任を要求。ホワイトハウスと国防総省は連絡がつかなくなったり、対応能力を失った閣僚に関する手順の見直しを発表した。
医師団によれば、オースティン長官は１日からの入院中、意識を失っておらず、麻酔もかけられていないという。
下院軍事委員会のロジャース委員長はオースティン長官が入院と能力喪失の報告を怠ったことについて正式調査を開始すると明らかにした。
原題：Austin Was Hospitalized Over Complications From Prostate Surgery、House Armed Services Chair Probes Austin’s Lack of Transparency（抜粋）",2024年1月10日 4:41 JST
2024-01-09,https://www.bloomberg.co.jp/news/articles/2024-01-09/S6ZXUVDWLU6800,出会い系のマッチが上昇、エリオットが10億ドル相当保有と報道,著者情報なし,"９日の米株式市場で、「ティンダー」などの出会い系プラットフォームを運営するマッチ・グループが上昇。アクティビスト（物言う投資家）のエリオット・インベストメント・マネジメントがマッチの株式約10億ドル（約1440億円）相当を保有していると、米紙ウォールストリート・ジャーナル（ＷＳＪ）が報じた。
８日のＷＳＪ報道によればエリオットはマッチに対し、株価押し上げに向けた措置を講じるよう働き掛ける意向。ＷＳＪは複数の関係者の話として伝えた。エリオットの具体的な要求や、同社が取締役候補の指名を目指す考えかどうかは分かっていないという。
マッチ株は３％高の39.04ドルで引けた。
マッチ・グループの広報担当は、「当社のチームは定期的に投資家と関わりを持っており、ユーザーには素晴らしい体験、そして株主には大きな価値をもたらせるよう今後も取り組んでいく」と表明しつつ、エリオットについてはコメントを控えた。
エリオットはコメントを控えた。
原題：Match Jumps on Report of Elliott’s $1 Billion Stake in Firm (2)（抜粋）",2024年1月9日 23:11 JST
2024-01-09,https://www.bloomberg.co.jp/news/articles/2024-01-09/S70AGEDWRGG000,【米国市況】Ｓ＆Ｐ500種が反落、資源や金融安い－ドル144円台半ば,著者情報なし,"９日の米株式市場ではＳ＆Ｐ500種株価指数が３営業日ぶりに下落。ハイテク中心に上げた前日の勢いは続かなかった。
この日は資源株と金融株が特に売られた。超大型株は高安まちまちで、エヌビディアとテスラは値下がりした。米ネットワーク機器メーカー、ジュニパーネットワークスは急伸。ヒューレット・パッカード・エンタープライズ（ＨＰＥ）に自社を売却する方向で交渉が進んでいるとの一部報道に反応した。
ジュニパー株急伸、ＨＰエンタープライズへの身売り交渉報道で
米利下げを積極的に織り込む動きと底堅い経済ファンダメンタルズの間でミスマッチが拡大しており、世界の金融市場には「ゴルディロックス」相場の反転リスクが生まれていると、ＨＳＢＣホールディングスのストラテジスト、マックス・ケトナー氏は指摘する。市場では現在、５月あるいは３月にも緩和サイクルが始まると織り込まれているが、同氏は米金融当局の利下げ開始時期は６月とみている。
世界の金融市場、ゴルディロックス相場の反転リスク－ＨＳＢＣが警鐘
ミラー・タバクのチーフ市場ストラテジスト、マット・メイリー氏は最近の市場ではテクニカル分析のセオリーとは逆方向に相場がブレイクする「ヘッドフェイクが起きている可能性が高い」と分析。「先週の下落がヘッドフェイクなのか、きのうの上昇がそうなのかはまだ分からない。幸いなことにラインは極めて明確に描かれており、２つのラインのうち１つが有意にブレイクすれば、どちらの状況がヘッドフェイクだったか分かる」と述べた。
個別銘柄ではボーイングが続落。アラスカ航空が運航するボーイング「７３７ＭＡＸ－９」の機体の一部が吹き飛ばされた問題で、米当局による調査では所在を確認できていない４本のボルトが焦点に浮上している。緊急点検を行った複数の航空会社から部品の緩みが報告されており、当局は同機以外にも調査を拡大する可能性があるとの考えを示した。
出会い系プラットフォームを運営するマッチ・グループは上昇。アクティビスト（物言う投資家）のエリオット・インベストメント・マネジメントがマッチの株式約10億ドル（約1440億円）相当を保有していると、米紙ウォールストリート・ジャーナル（ＷＳＪ）が報じた。
米国債相場は上昇（利回りは低下）。３年債入札は堅調で、米国時間帯の午後の取引では大きな動きは見られなかった。欧州中核国の債券安を受けて米国債も早い時間には下げたが、その後上げに転じた。10年債利回りは４％近辺で推移した。
米３年債入札（発行額520億ドル）では、最高落札利回りが4.105％と、昨年５月以来の低さ。投資家の需要を測る応札倍率は2.67倍だった。過去６回の入札の平均は2.70倍。
外国為替市場では、米国株が下げる中でドルが主要10通貨の大半に対して上昇した。
ブルームバーグ・エコノミクスは11日発表される12月の米消費者物価指数（ＣＰＩ）について、「スーパーコア」項目のディスインフレペースが引き続き極めて遅いことが示されると予想。12日発表の生産者物価指数（ＰＰＩ）については、サプライチェーンに再び目詰まりが生じている状況が反映されるとみている。
米連邦準備制度理事会（ＦＲＢ）のバー副議長（銀行監督担当）は、地銀問題を受けて昨年導入した緊急貸出制度について、延長する可能性は低いと示唆した。
円は対ドルで下落。一時144円62銭を付けた。９日発表された12月の東京都区部の消費者物価指数（生鮮食品を除くコアＣＰＩ）は、プラス幅が２カ月連続で縮小した。
東京消費者物価２カ月連続伸び縮小、エネルギーが過去最大の下落 (2)
ニューヨーク原油先物相場は反発。前日には約１カ月ぶりの大幅安となっていた。
原油先物のプロンプトスプレッドは一時、昨年11月以来のバックワーデーション（逆ざや）となった。期先物より期近物の価格が高いバックワーデーションは強気のシグナルとされる。オプション市場では原油価格が年初来の低迷を脱したとの見方が一部で強まっている。
石油輸出国機構（ＯＰＥＣ）と非加盟産油国で構成する「ＯＰＥＣプラス」による減産で需給が引き締まる中、米エネルギー情報局（ＥＩＡ）は2024年の世界の石油需要は供給を日量12万バレル上回るとの予想を示した。ＥＩＡは月報で、３月の北海ブレント先物の予想を平均１バレル＝85ドルに上方修正。前月の予想は同78ドルだった。
ニューヨーク商業取引所（ＮＹＭＥＸ）のウェスト・テキサス・インターミディエート（ＷＴＩ）先物２月限は前日比1.47ドル（2.1％）高の１バレル＝72.24ドルで終了。ロンドンＩＣＥの北海ブレント３月限は1.47ドル（1.9％）高の77.59ドル。
ニューヨーク金相場はほぼ横ばい。市場参加者は前日の米金融当局者発言を消化しつつ、11日発表の米ＣＰＩに身構えている。
ボウマン米連邦準備制度理事会（ＦＲＢ）理事は８日、金利が現行水準に維持されれば、インフレ率は当局目標の２％に鈍化すると考えられるとし、物価上昇圧力が後退すれば利下げを支持する可能性を示唆した。アトランタ連銀のボスティック総裁は同日、米国のインフレ率は自身が予想していたよりも低下し、金融当局の目標である２％への道筋が見えてきたとの見解を示し上で、勝利宣言には時期尚早だと述べた。
バート・メレク氏らＴＤセキュリティーズの商品ストラテジストによると、中国からの買いがニューヨーク金相場を支える一因になっている。２月10日に始まる旧正月（春節）を前に、中国当局が銀行に金の輸入割当を与えた可能性があると同氏らは指摘。「この場合、中国の銀行はスプレッドを確定するために上海市場で金を売り、ロンドンもしくはＣＯＭＥＸ（ニューヨーク商品取引所）で金を買っている公算が大きい」と述べた。
ニューヨーク商品取引所の金先物２月限は前日比50セント（0.1％未満）安の１オンス＝2033ドルちょうどで終了した。
原題：Stocks Struggle After Tech-Led Bounce; Oil Climbs: Markets Wrap（抜粋）
Treasuries Hold Gains After Solid 3Y Sale; Weekly Options Active（抜粋）
Treasury 3-Year Auction Stops Through at Lowest Yield Since May（抜粋）
Dollar Firms As Equity Gains Stall, Oil Advances: Inside G-10（抜粋）
Oil-Market Gauges Show Conviction in Rebound After Recent Slump（抜粋）
Gold Steadies as Traders Seek Clues on Fed’s Interest-Rate Path（抜粋）",2024年1月10日 6:45 JST
2024-01-10,https://www.bloomberg.co.jp/news/articles/2024-01-10/S72BBXT0G1KW00,ＮＹ連銀総裁、政策金利はインフレ目標達成には十分な高さにある,著者情報なし,"米ニューヨーク連銀のウィリアムズ総裁は10日、金融政策はインフレ率を金融当局の目標に戻すのに十分なだけ引き締められているが、利下げ前にインフレの落ち着きを示す証拠がもっと必要だとの認識を示した。
ウィリアムズ総裁は講演で、「現在の金融政策の景気抑制的スタンスがバランスの回復を継続させインフレ率を２％の長期目標に戻すというのが私の基本的な考え方だ」と説明した。
「金融当局の目標を完全に達成するにはしばらくの間、景気抑制的な政策スタンスを維持する必要があるだろう。インフレ率が持続的に２％に向かうと確信したときにのみ、抑制の程度を緩めることが適切となる」との見解を示した。
同総裁はインフレ減速とともに金利が低下するのは自然なことだと述べる一方で、利下げのタイミングとスピードは「インフレ率や経済がどのように推移するかに左右される」とした。
今回の講演のトーンは、昨年12月15日の同総裁の発言とは異なる。当時総裁は当局の短期的な問題はインフレ率の２％への回帰を確実にするために政策が「十分に景気抑制的」かどうかだと述べ、当局者は「利下げについてそれほど協議していない」としていた。
ウィリアムズ総裁は10日、インフレの見通しについて楽観的な見方を示し、「３％や４％といった高過ぎる水準にとどまることは心配していない。正しい方向に進んでいる」と話した。
同総裁はまた、ダラス連銀のローガン総裁が、政策当局は量的引き締め（ＱＴ）として知られるバランスシートのランオフ（償還に伴う保有証券減少）の減速を議論し始めるべきだと発言したことに異論を表明。銀行の準備預金は当局がＱＴに着手する前の水準とほとんど変わっていないと指摘した。
ウィリアムズ総裁は「連邦公開市場委員会（ＦＯＭＣ）は計画の中で、円滑な移行を確実にするため、準備預金残高が潤沢な準備預金に一致すると判断される水準を幾分上回った時点で、バランスシートの圧縮を減速させ、その後停止させる方針だとしている。今のところ、その時点には近づいていないように見受けられる」と述べた。
原題：Fed’s Williams Says Rates High Enough to Cool Inflation to Goal(抜粋)",2024年1月11日 6:34 JST
2024-01-10,https://www.bloomberg.co.jp/news/articles/2024-01-10/S72AFZT1UM0W00,米国債相場の上昇見込む取引、後退する方向－ＣＰＩ発表控え,著者情報なし,"米国債相場は11日に発表される米消費者物価指数（ＣＰＩ）統計を材料に荒っぽい展開になると市場で予想されている。相場上昇を見込んだ賭けが2023年末には奏功したが、こうした投資を見直す動きがある。
トレーダーらは今月に入り、米国債値上がり予想を後退させ、相場が下落した場合に利益を得る投資を増やしている。
ＪＰモルガン・チェースの顧客調査によると、コンセンサスはなお相場上昇継続に傾いているが、足元の市場のポジションはこの４カ月で最も中立的だ。これは、多くの投資家が今後の相場動向が一段と明確になった時にロングかショートのどちらかを選ぶタイミングを待っていることを示唆している。
年明け後の米国債市場は、24年の明確な方向性をなかなか見いだせないでいる。確信が得られない背景には、昨年末までの数週間の相場急上昇がある。この値上がりを受け、米国債のリターンは20年以来のプラスを記録した。
ただ、10年債利回りが昨年10月に付けた５％超の高水準から約１ポイント低下し、スワップ市場は今年５回を超える利下げを既に織り込む中で、市場を再び活性化させ得る統計に注目が集まっている。
ブルームバーグのエコノミスト調査によると、12月のＣＰＩ統計では食品とエネルギーを除くコアインフレ率が前年同月比3.8％上昇と前月を下回る伸びにとどまる見通しだ。
オプション市場の動向では、今週末に満期を迎える契約を通じ、利回り上昇をヘッジするオプションの需要が急増している。
原題：US Bond Markets Are Trimming Bets on Treasuries Ahead of CPI（抜粋）",2024年1月11日 7:16 JST
2024-01-10,https://www.bloomberg.co.jp/news/articles/2024-01-10/S72DX4T1UM0W00,モルガンＳ、新マネジングディレクター155人指名－前年下回る,著者情報なし,"米モルガン･スタンレーは社員155人をマネジングディレクター（ＭＤ）に昇格させた。ＭＤへの昇格者数は前年を下回った。
事情に詳しい関係者１人によれば、このうち女性の割合は37％となり、女性がＭＤ全体に占める比率は26％に上昇した。昇格した米国人のうち、黒人は６％、ヒスパニック系は７％、アジア系は15％だという。
昨年は184人がＭＤに昇格していた。米国で今回昇格したＭＤでは、民族的に多様と見なされる人の割合が29％だった。ウォール街全般と同様に同行の経営陣は長年にわたりほとんどが白人男性で占められてきた。
新ＭＤの地域別割合は米州が58％、欧州・中東・アフリカ（ＥＭＥＡ）が22％、アジアが20％で、11カ国となっている。
同行ではテッド・ピック氏が、ジェームズ・ゴーマン氏の後任として最高経営責任者（ＣＥＯ）に就任したばかり。
モルガン・スタンレーの広報担当者は今回の昇格を確認した。
原題：Morgan Stanley Names 155 to Managing Director as Class Shrinks（抜粋）
— 取材協力 Sridhar Natarajan",2024年1月11日 7:00 JST
2024-01-11,https://www.bloomberg.co.jp/news/articles/2024-01-11/S74B8XT0G1KW00,米クレジットカード延滞率、10年ぶり高水準－生計費上昇が家計圧迫,著者情報なし,"クレジットカード延滞率が新型コロナウイルス禍前の水準を上回り、最低返済額しか支払っていない借り手の割合は2019年以来初めて10％台に達したことが、フィラデルフィア連銀の報告書で明らかになった。
同連銀によると、昨年９月末時点でクレジットカード残高の約3.2％相当が少なくとも30日延滞だった。前四半期からは0.4ポイント余り上昇し、約10年ぶりの高水準となった。60日と90日の延滞が残高に占める比率も大きく上昇した。
フィラデルフィア連銀は「消費者の脆弱（ぜいじゃく）性が強まる」兆しを受け、銀行は与信枠の引き上げを減らし、引き下げを増やしていると指摘。データは資産1000億ドル（約14兆5000億円）以上の大手銀行のローンが対象。
コロナ禍後の生計費急増に所得増加が必ずしも追いついておらず、米家計が圧迫されていることが示された。フィラデルフィア連銀によると、今やクレジットカードの借り手の約１割で口座残高が5000ドルを超えている。
一方、銀行は借入限度額の引き下げを進めているため、消費者は既存の与信枠をより活用する傾向があるという。カード利用者の約10人に１人は残高が限度額の95％に達している。支払いが毎月の最低返済額にとどまる人も同様の割合で、19年以来の高水準にある。
原題：Credit Card Delinquency Rates Climb to Decade High in Fed Study（抜粋）",2024年1月12日 8:40 JST
2024-01-11,https://www.bloomberg.co.jp/news/articles/2024-01-11/S7455BT0AFB400,米インフレ加速、財価格の低下基調止まる－サービス価格なお高水準,著者情報なし,"米インフレ率は2023年末に加速した。サービス価格がなお高水準で推移したほか、財価格の低下基調にブレーキがかかった。
米労働統計局（ＢＬＳ）の統計によると、 昨年12月の米消費者物価指数（ＣＰＩ）総合指数は前年同月比3.4％上昇と、３カ月ぶりの大きな伸びを示した。前月比でも予想以上に上振れした。住居費が引き続き上昇し、自動車関連費用が増えたほか、エネルギー価格は９月以来初めて上昇した。
米金融当局がインフレ抑制で険しい道のりに直面していることがこの統計で示された。衣料品や自動車など財価格の上昇が続けば、インフレ率は今後数カ月にわたって高止まりする恐れがある。主にサプライチェーンの状況改善に伴う最近の下降傾向の持続性を疑問視する声が、政策当局者や米金融業界のエコノミストから出始めている。
食品とエネルギーを除いたコア財価格で主なサプライズは、年末の販促活動にもかかわらず中古車と衣料品価格が上昇したことだ。サービス価格も鈍化の兆しが見られず、特に住居費と自動車保険でその傾向が顕著だった。自動車保険の上昇率は前年同月比ベースで1976年以来の大きさとなった。
ＢＭＯキャピタル・マーケッツの米国担当チーフエコノミスト、スコット・アンダーソン氏はリポートで、「米金融当局は現段階で、財やエネルギー価格においてデフレやディスインフレが後退しつつあることに懸念を強めているはずだ。また住居や大半のサービス分野でインフレがまだ大きく減速していない」とした上で、「持続可能な２％のインフレ率を目指す米当局の行程がなお完了していないことが示唆された」と指摘した。
統計発表を受け、Ｓ＆Ｐ500種株価指数は下落し、米国債は不安定な動きを示した。米連邦公開市場委員会（ＦＯＭＣ）次回会合は今月末に予定されている。
原題：US Inflation Picks Up as Goods Prices Halt Months-Long Decline（抜粋）
— 取材協力 Chris Middleton and Reade Pickert",2024年1月12日 8:08 JST
